{
  "format": "csm-asc3-plan",
  "formatVersion": 1,
  "generator": "SPATT",
  "name": "CSM ASC-3 default",
  "phases": [
    {
      "number": 1,
      "enabled": true,
      "barrier": 0,
      "minGreen": 100,
      "passage": 40,
      "maxGreen": 600,
      "maxGreen2": 0,
      "yellow": 70,
      "redClear": 40,
      "addedInitial": 0,
      "maxInitial": 0,
      "minGap": 0,
      "timeBeforeReduce": 0,
      "timeToReduce": 0,
      "recall": "NONE",
      "pedRecall": false,
      "restInWalk": false,
      "dualEntry": false,
      "conditionalService": false,
      "lockCall": false,
      "label": "Phase 1",
      "walk": 140,
      "pedClear": 200
    },
    {
      "number": 2,
      "enabled": true,
      "barrier": 0,
      "minGreen": 100,
      "passage": 40,
      "maxGreen": 600,
      "maxGreen2": 0,
      "yellow": 70,
      "redClear": 40,
      "addedInitial": 0,
      "maxInitial": 0,
      "minGap": 0,
      "timeBeforeReduce": 0,
      "timeToReduce": 0,
      "recall": "NONE",
      "pedRecall": false,
      "restInWalk": false,
      "dualEntry": false,
      "conditionalService": false,
      "lockCall": false,
      "label": "Phase 2",
      "walk": 140,
      "pedClear": 200
    },
    {
      "number": 3,
      "enabled": true,
      "barrier": 1,
      "minGreen": 100,
      "passage": 40,
      "maxGreen": 600,
      "maxGreen2": 0,
      "yellow": 70,
      "redClear": 40,
      "addedInitial": 0,
      "maxInitial": 0,
      "minGap": 0,
      "timeBeforeReduce": 0,
      "timeToReduce": 0,
      "recall": "NONE",
      "pedRecall": false,
      "restInWalk": false,
      "dualEntry": false,
      "conditionalService": false,
      "lockCall": false,
      "label": "Phase 3",
      "walk": 140,
      "pedClear": 200
    },
    {
      "number": 4,
      "enabled": true,
      "barrier": 1,
      "minGreen": 100,
      "passage": 40,
      "maxGreen": 600,
      "maxGreen2": 0,
      "yellow": 70,
      "redClear": 40,
      "addedInitial": 0,
      "maxInitial": 0,
      "minGap": 0,
      "timeBeforeReduce": 0,
      "timeToReduce": 0,
      "recall": "NONE",
      "pedRecall": false,
      "restInWalk": false,
      "dualEntry": false,
      "conditionalService": false,
      "lockCall": false,
      "label": "Phase 4",
      "walk": 140,
      "pedClear": 200
    },
    {
      "number": 5,
      "enabled": true,
      "barrier": 0,
      "minGreen": 100,
      "passage": 40,
      "maxGreen": 600,
      "maxGreen2": 0,
      "yellow": 70,
      "redClear": 40,
      "addedInitial": 0,
      "maxInitial": 0,
      "minGap": 0,
      "timeBeforeReduce": 0,
      "timeToReduce": 0,
      "recall": "NONE",
      "pedRecall": false,
      "restInWalk": false,
      "dualEntry": false,
      "conditionalService": false,
      "lockCall": false,
      "label": "Phase 5",
      "walk": 140,
      "pedClear": 200
    },
    {
      "number": 6,
      "enabled": true,
      "barrier": 0,
      "minGreen": 100,
      "passage": 40,
      "maxGreen": 600,
      "maxGreen2": 0,
      "yellow": 70,
      "redClear": 40,
      "addedInitial": 0,
      "maxInitial": 0,
      "minGap": 0,
      "timeBeforeReduce": 0,
      "timeToReduce": 0,
      "recall": "NONE",
      "pedRecall": false,
      "restInWalk": false,
      "dualEntry": false,
      "conditionalService": false,
      "lockCall": false,
      "label": "Phase 6",
      "walk": 140,
      "pedClear": 200
    },
    {
      "number": 7,
      "enabled": true,
      "barrier": 1,
      "minGreen": 100,
      "passage": 40,
      "maxGreen": 600,
      "maxGreen2": 0,
      "yellow": 70,
      "redClear": 40,
      "addedInitial": 0,
      "maxInitial": 0,
      "minGap": 0,
      "timeBeforeReduce": 0,
      "timeToReduce": 0,
      "recall": "NONE",
      "pedRecall": false,
      "restInWalk": false,
      "dualEntry": false,
      "conditionalService": false,
      "lockCall": false,
      "label": "Phase 7",
      "walk": 140,
      "pedClear": 200
    },
    {
      "number": 8,
      "enabled": true,
      "barrier": 1,
      "minGreen": 100,
      "passage": 40,
      "maxGreen": 600,
      "maxGreen2": 0,
      "yellow": 70,
      "redClear": 40,
      "addedInitial": 0,
      "maxInitial": 0,
      "minGap": 0,
      "timeBeforeReduce": 0,
      "timeToReduce": 0,
      "recall": "NONE",
      "pedRecall": false,
      "restInWalk": false,
      "dualEntry": false,
      "conditionalService": false,
      "lockCall": false,
      "label": "Phase 8",
      "walk": 140,
      "pedClear": 200
    }
  ],
  "rings": [
    [
      1,
      2,
      3,
      4
    ],
    [
      5,
      6,
      7,
      8
    ]
  ],
  "patterns": [
    {
      "slot": 0,
      "mode": "FREE",
      "cycle": 1800,
      "offset": 0,
      "coordinatedPhases": [
        2,
        6
      ],
      "splits": {
        "1": 450,
        "2": 450,
        "3": 450,
        "4": 450,
        "5": 450,
        "6": 450,
        "7": 450,
        "8": 450
      },
      "name": "Pattern 1"
    }
  ],
  "schedule": {
    "enabled": false,
    "startHours": [
      6,
      9,
      15,
      19
    ]
  }
}
