{
  "format": "csm-asc3-plan",
  "formatVersion": 1,
  "generator": "SPATT",
  "name": "Main St & Side St",
  "phases": [
    {
      "number": 1,
      "enabled": true,
      "barrier": 0,
      "minGreen": 100,
      "passage": 40,
      "maxGreen": 400,
      "maxGreen2": 0,
      "yellow": 70,
      "redClear": 30,
      "addedInitial": 0,
      "maxInitial": 0,
      "minGap": 0,
      "timeBeforeReduce": 0,
      "timeToReduce": 0,
      "recall": "NONE",
      "pedRecall": false,
      "restInWalk": false,
      "dualEntry": false,
      "conditionalService": false,
      "lockCall": false,
      "label": "WB Left"
    },
    {
      "number": 2,
      "enabled": true,
      "barrier": 0,
      "minGreen": 200,
      "passage": 60,
      "maxGreen": 800,
      "maxGreen2": 0,
      "yellow": 80,
      "redClear": 40,
      "addedInitial": 0,
      "maxInitial": 0,
      "minGap": 0,
      "timeBeforeReduce": 0,
      "timeToReduce": 0,
      "recall": "NONE",
      "pedRecall": false,
      "restInWalk": false,
      "dualEntry": false,
      "conditionalService": false,
      "lockCall": false,
      "label": "EB Thru",
      "walk": 140,
      "pedClear": 360
    },
    {
      "number": 3,
      "enabled": true,
      "barrier": 1,
      "minGreen": 100,
      "passage": 40,
      "maxGreen": 400,
      "maxGreen2": 0,
      "yellow": 70,
      "redClear": 30,
      "addedInitial": 0,
      "maxInitial": 0,
      "minGap": 0,
      "timeBeforeReduce": 0,
      "timeToReduce": 0,
      "recall": "NONE",
      "pedRecall": false,
      "restInWalk": false,
      "dualEntry": false,
      "conditionalService": false,
      "lockCall": false,
      "label": "NB Left"
    },
    {
      "number": 4,
      "enabled": true,
      "barrier": 1,
      "minGreen": 200,
      "passage": 60,
      "maxGreen": 600,
      "maxGreen2": 0,
      "yellow": 80,
      "redClear": 40,
      "addedInitial": 0,
      "maxInitial": 0,
      "minGap": 0,
      "timeBeforeReduce": 0,
      "timeToReduce": 0,
      "recall": "NONE",
      "pedRecall": false,
      "restInWalk": false,
      "dualEntry": false,
      "conditionalService": false,
      "lockCall": false,
      "label": "SB Thru",
      "walk": 140,
      "pedClear": 280
    },
    {
      "number": 5,
      "enabled": true,
      "barrier": 0,
      "minGreen": 100,
      "passage": 40,
      "maxGreen": 400,
      "maxGreen2": 0,
      "yellow": 70,
      "redClear": 30,
      "addedInitial": 0,
      "maxInitial": 0,
      "minGap": 0,
      "timeBeforeReduce": 0,
      "timeToReduce": 0,
      "recall": "NONE",
      "pedRecall": false,
      "restInWalk": false,
      "dualEntry": false,
      "conditionalService": false,
      "lockCall": false,
      "label": "EB Left"
    },
    {
      "number": 6,
      "enabled": true,
      "barrier": 0,
      "minGreen": 200,
      "passage": 60,
      "maxGreen": 800,
      "maxGreen2": 0,
      "yellow": 80,
      "redClear": 40,
      "addedInitial": 0,
      "maxInitial": 0,
      "minGap": 0,
      "timeBeforeReduce": 0,
      "timeToReduce": 0,
      "recall": "NONE",
      "pedRecall": false,
      "restInWalk": false,
      "dualEntry": false,
      "conditionalService": false,
      "lockCall": false,
      "label": "WB Thru",
      "walk": 140,
      "pedClear": 360
    },
    {
      "number": 7,
      "enabled": true,
      "barrier": 1,
      "minGreen": 100,
      "passage": 40,
      "maxGreen": 400,
      "maxGreen2": 0,
      "yellow": 70,
      "redClear": 30,
      "addedInitial": 0,
      "maxInitial": 0,
      "minGap": 0,
      "timeBeforeReduce": 0,
      "timeToReduce": 0,
      "recall": "NONE",
      "pedRecall": false,
      "restInWalk": false,
      "dualEntry": false,
      "conditionalService": false,
      "lockCall": false,
      "label": "SB Left"
    },
    {
      "number": 8,
      "enabled": true,
      "barrier": 1,
      "minGreen": 200,
      "passage": 60,
      "maxGreen": 600,
      "maxGreen2": 0,
      "yellow": 80,
      "redClear": 40,
      "addedInitial": 0,
      "maxInitial": 0,
      "minGap": 0,
      "timeBeforeReduce": 0,
      "timeToReduce": 0,
      "recall": "NONE",
      "pedRecall": false,
      "restInWalk": false,
      "dualEntry": false,
      "conditionalService": false,
      "lockCall": false,
      "label": "NB Thru",
      "walk": 140,
      "pedClear": 280
    }
  ],
  "rings": [
    [
      1,
      2,
      3,
      4
    ],
    [
      5,
      6,
      7,
      8
    ]
  ],
  "patterns": [
    {
      "slot": 0,
      "mode": "COORDINATED",
      "cycle": 1800,
      "offset": 1500,
      "coordinatedPhases": [
        2,
        6
      ],
      "splits": {
        "1": 300,
        "2": 700,
        "3": 240,
        "4": 560,
        "5": 300,
        "6": 700,
        "7": 240,
        "8": 560
      },
      "name": "AM Peak"
    },
    {
      "slot": 1,
      "mode": "FREE",
      "cycle": 1800,
      "offset": 0,
      "coordinatedPhases": [],
      "splits": {}
    }
  ],
  "schedule": {
    "enabled": true,
    "startHours": [
      6,
      22,
      6,
      6
    ]
  }
}
